{
  "$schema": "https://json-schema.org/draft/2020-12/schema",
  "title": "Semaporter Theme",
  "description": "Version 1: Design-Datei. Text- und Schaltflächenkontrast werden zusätzlich beim Import geprüft.",
  "type": "object",
  "additionalProperties": false,
  "required": [
    "schema_version",
    "id",
    "name",
    "base"
  ],
  "properties": {
    "schema_version": {
      "const": 1
    },
    "id": {
      "type": "string",
      "pattern": "^[a-z0-9][a-z0-9-]{1,47}$"
    },
    "name": {
      "type": "string",
      "minLength": 1,
      "maxLength": 80
    },
    "description": {
      "type": "string",
      "maxLength": 240
    },
    "base": {
      "enum": [
        "neutral-dark",
        "neutral-light",
        "github-dark",
        "sit-light",
        "sit-dark"
      ]
    },
    "font": {
      "enum": [
        "system",
        "sora"
      ]
    },
    "radius": {
      "type": "integer",
      "minimum": 0,
      "maximum": 16
    },
    "colors": {
      "type": "object",
      "additionalProperties": false,
      "properties": {
        "bg": {
          "type": "string",
          "pattern": "^#[0-9a-fA-F]{6}$"
        },
        "header": {
          "type": "string",
          "pattern": "^#[0-9a-fA-F]{6}$"
        },
        "surface": {
          "type": "string",
          "pattern": "^#[0-9a-fA-F]{6}$"
        },
        "surface-alt": {
          "type": "string",
          "pattern": "^#[0-9a-fA-F]{6}$"
        },
        "surface-soft": {
          "type": "string",
          "pattern": "^#[0-9a-fA-F]{6}$"
        },
        "hover": {
          "type": "string",
          "pattern": "^#[0-9a-fA-F]{6}$"
        },
        "border": {
          "type": "string",
          "pattern": "^#[0-9a-fA-F]{6}$"
        },
        "border-soft": {
          "type": "string",
          "pattern": "^#[0-9a-fA-F]{6}$"
        },
        "text": {
          "type": "string",
          "pattern": "^#[0-9a-fA-F]{6}$"
        },
        "muted": {
          "type": "string",
          "pattern": "^#[0-9a-fA-F]{6}$"
        },
        "accent": {
          "type": "string",
          "pattern": "^#[0-9a-fA-F]{6}$"
        },
        "accent-hover": {
          "type": "string",
          "pattern": "^#[0-9a-fA-F]{6}$"
        },
        "accent-soft": {
          "type": "string",
          "pattern": "^#[0-9a-fA-F]{6}([0-9a-fA-F]{2})?$"
        },
        "accent-border": {
          "type": "string",
          "pattern": "^#[0-9a-fA-F]{6}([0-9a-fA-F]{2})?$"
        },
        "nav-indicator": {
          "type": "string",
          "pattern": "^#[0-9a-fA-F]{6}$"
        },
        "primary": {
          "type": "string",
          "pattern": "^#[0-9a-fA-F]{6}$"
        },
        "primary-hover": {
          "type": "string",
          "pattern": "^#[0-9a-fA-F]{6}$"
        },
        "primary-border": {
          "type": "string",
          "pattern": "^#[0-9a-fA-F]{6}([0-9a-fA-F]{2})?$"
        },
        "on-primary": {
          "type": "string",
          "pattern": "^#[0-9a-fA-F]{6}$"
        },
        "success": {
          "type": "string",
          "pattern": "^#[0-9a-fA-F]{6}$"
        },
        "success-soft": {
          "type": "string",
          "pattern": "^#[0-9a-fA-F]{6}([0-9a-fA-F]{2})?$"
        },
        "success-border": {
          "type": "string",
          "pattern": "^#[0-9a-fA-F]{6}([0-9a-fA-F]{2})?$"
        },
        "warning": {
          "type": "string",
          "pattern": "^#[0-9a-fA-F]{6}$"
        },
        "warning-soft": {
          "type": "string",
          "pattern": "^#[0-9a-fA-F]{6}([0-9a-fA-F]{2})?$"
        },
        "warning-border": {
          "type": "string",
          "pattern": "^#[0-9a-fA-F]{6}([0-9a-fA-F]{2})?$"
        },
        "danger": {
          "type": "string",
          "pattern": "^#[0-9a-fA-F]{6}$"
        },
        "danger-soft": {
          "type": "string",
          "pattern": "^#[0-9a-fA-F]{6}([0-9a-fA-F]{2})?$"
        },
        "danger-border": {
          "type": "string",
          "pattern": "^#[0-9a-fA-F]{6}([0-9a-fA-F]{2})?$"
        },
        "danger-hover": {
          "type": "string",
          "pattern": "^#[0-9a-fA-F]{6}$"
        },
        "on-danger": {
          "type": "string",
          "pattern": "^#[0-9a-fA-F]{6}$"
        },
        "on-emphasis": {
          "type": "string",
          "pattern": "^#[0-9a-fA-F]{6}$"
        },
        "overlay": {
          "type": "string",
          "pattern": "^#[0-9a-fA-F]{6}([0-9a-fA-F]{2})?$"
        },
        "selection": {
          "type": "string",
          "pattern": "^#[0-9a-fA-F]{6}$"
        },
        "on-selection": {
          "type": "string",
          "pattern": "^#[0-9a-fA-F]{6}$"
        }
      }
    },
    "branding": {
      "enum": [
        "neutral",
        "sit"
      ],
      "description": "Legacy field, normalized to logoAsset on import."
    },
    "copy": {
      "type": "object",
      "additionalProperties": false,
      "properties": {
        "title": {
          "type": "string",
          "minLength": 1,
          "maxLength": 100
        },
        "subtitle": {
          "type": "string",
          "minLength": 1,
          "maxLength": 100
        },
        "headline": {
          "type": "string",
          "minLength": 1,
          "maxLength": 100
        },
        "emphasis": {
          "type": "string",
          "minLength": 1,
          "maxLength": 100
        },
        "intro": {
          "type": "string",
          "minLength": 1,
          "maxLength": 400
        },
        "welcome": {
          "type": "string",
          "minLength": 1,
          "maxLength": 100
        },
        "loginHint": {
          "type": "string",
          "minLength": 1,
          "maxLength": 100
        }
      }
    },
    "logo": {
      "type": "string",
      "maxLength": 350000,
      "pattern": "^data:image/(png|jpeg|webp|gif);base64,[A-Za-z0-9+/]+={0,2}$"
    },
    "loginBackground": {
      "type": "string",
      "maxLength": 350000,
      "pattern": "^data:image/(png|jpeg|webp|gif);base64,[A-Za-z0-9+/]+={0,2}$"
    },
    "loginBackgroundBlur": {
      "type": "integer",
      "minimum": 0,
      "maximum": 24
    },
    "logoWidth": {
      "type": "integer",
      "minimum": 32,
      "maximum": 120
    },
    "legal": {
      "type": "object",
      "additionalProperties": false,
      "properties": {
        "footer": {
          "type": "string",
          "maxLength": 160
        },
        "imprint": {
          "type": "string",
          "maxLength": 12000
        },
        "privacy": {
          "type": "string",
          "maxLength": 12000
        }
      }
    },
    "logoAsset": {
      "enum": [
        "sit-logo"
      ]
    },
    "logoTone": {
      "enum": [
        "original",
        "dark"
      ]
    }
  }
}
